{
  "schema": 1,
  "kind": "whale_roster_public",
  "buy_signal": false,
  "measured_factor": true,
  "min_sample": 8,
  "asof": "2026-10-31T14:17:07Z",
  "note": "Research tally. A hit is a favorable price or liquidity change at +1h, +6h, or +24h. Rates stay blank under 8 events. Not a buy signal.",
  "whales": [
    {
      "codename": "Grumpy Walrus",
      "role": "lead",
      "status": "active",
      "scores": {
        "events": 582,
        "accumulate": 577,
        "trim": 0,
        "exit": 5,
        "priced_h1": 32,
        "hits_h1": 15,
        "hit_rate_h1": 0.469,
        "priced_h6": 36,
        "hits_h6": 25,
        "hit_rate_h6": 0.694,
        "priced_h24": 17,
        "hits_h24": 13,
        "hit_rate_h24": 0.765,
        "small_sample": false,
        "social_moves_matched": null
      }
    },
    {
      "codename": "Dapper Badger",
      "role": "watch",
      "status": "candidate",
      "scores": {
        "events": 0,
        "accumulate": 0,
        "trim": 0,
        "exit": 0,
        "priced_h1": 0,
        "hits_h1": 0,
        "hit_rate_h1": null,
        "priced_h6": 0,
        "hits_h6": 0,
        "hit_rate_h6": null,
        "priced_h24": 0,
        "hits_h24": 0,
        "hit_rate_h24": null,
        "small_sample": true,
        "social_moves_matched": null
      }
    },
    {
      "codename": "Lucky Urchin",
      "role": "watch",
      "status": "candidate",
      "scores": {
        "events": 0,
        "accumulate": 0,
        "trim": 0,
        "exit": 0,
        "priced_h1": 0,
        "hits_h1": 0,
        "hit_rate_h1": null,
        "priced_h6": 0,
        "hits_h6": 0,
        "hit_rate_h6": null,
        "priced_h24": 0,
        "hits_h24": 0,
        "hit_rate_h24": null,
        "small_sample": true,
        "social_moves_matched": null
      }
    },
    {
      "codename": "Keen Heron",
      "role": "watch",
      "status": "candidate",
      "scores": {
        "events": 0,
        "accumulate": 0,
        "trim": 0,
        "exit": 0,
        "priced_h1": 0,
        "hits_h1": 0,
        "hit_rate_h1": null,
        "priced_h6": 0,
        "hits_h6": 0,
        "hit_rate_h6": null,
        "priced_h24": 0,
        "hits_h24": 0,
        "hit_rate_h24": null,
        "small_sample": true,
        "social_moves_matched": null
      }
    }
  ]
}
