{
  "schema": 1,
  "kind": "whale_roster_public",
  "buy_signal": false,
  "measured_factor": true,
  "min_sample": 8,
  "asof": "2026-10-29T16:00:00Z",
  "note": "Research tally. A hit is a favorable price or liquidity change at +1h, +6h, or +24h. Rates stay blank under 8 events. Not a buy signal.",
  "whales": [
    {
      "codename": "Grumpy Walrus",
      "role": "lead",
      "status": "active",
      "scores": {
        "events": 3,
        "accumulate": 1,
        "trim": 1,
        "exit": 1,
        "priced_h1": 1,
        "priced_h6": 0,
        "priced_h24": 0,
        "hits_h1": 1,
        "hits_h6": 0,
        "hits_h24": 0,
        "hit_rate_h1": null,
        "hit_rate_h6": null,
        "hit_rate_h24": null,
        "small_sample": true,
        "social_moves_matched": null
      }
    },
    {
      "codename": "Sleepy Otter",
      "role": "watch",
      "status": "candidate",
      "scores": {
        "events": 0,
        "accumulate": 0,
        "trim": 0,
        "exit": 0,
        "priced_h1": 0,
        "priced_h6": 0,
        "priced_h24": 0,
        "hits_h1": 0,
        "hits_h6": 0,
        "hits_h24": 0,
        "hit_rate_h1": null,
        "hit_rate_h6": null,
        "hit_rate_h24": null,
        "small_sample": true,
        "social_moves_matched": null
      }
    }
  ]
}
